Тема,Номер вопроса,Вопрос,Картинка,Ответ,Неверные ответы
Первая мировая война,1,Первая мировая война началась в 1914 году? ,-,Да,
,,Первая мировая война закончилась в 1918 году?,-,Да,
,,Участвовала ли Испания в Первой мировой войне? ,-,Нет,
,,Битва при Сомме была в 1916 году? ,-,Да,
,,Убийство Франца Фердинанда стало поводом к началу Первой мировой войны? ,-,Да,
,,Битва при Танненберге состаялась в 1916 году? ,-,Нет,
,,Битва при Вердене была самой длинной в истории Первой мировой войны?  ,-,Да,
,,Была ли Австро-Венгрия союзником Германии в Первой мировой войне?,-,Да,
,,Битва на Марне состаялась в 1915 году?,-,Нет,
,,Распутин был убит во время Первой мировой войны? ,-,Да,
,2,Была ли Россия в составе Антанты? ,-,Да,
,,Соединённые Штаты Америки вступили в Первую мировую войну 6 апреля 1916 года? ,-,Нет,
,,Брестский мир подписывался в 1917 году? ,-,Нет,
,,Италия изначально входила в Тройственный союз? ,-,Да,
,,Брестский мир подписала Советская Россия? ,-,Да,
,, Япония входила в Антанту? ,-,Да,
,,Германия подписала Версальский мир в 1919 году? ,-,Да,
,,Османская империя входила в состав Антанты?,-,Нет,
,,Россия была выведена из Первой мировой войны до её окончания? ,-,Да,
,,Турция была союзницей Франции в Первой мировой войне?,-,Нет,
,3,"Кто этот человек?  Последний император России, правивший во время Первой мировой войны.",images\img_1.png,Николай II,"Николай I, Александр III"
,,"Кто этот человек?  Сербский националист, убийца эрцгерцога Франца Фердинанда.",images\img_2.png,Принцип/Гаврило Принцип,"Радомир Путник, Жозеф Жоффр"
,,"Кто этот человек? Президент США, предложивший «14 пунктов» мира.",images\img_3.png,Вудро Вильсон/Вильсон,"Джон Першинг, Уоррен Гардинг"
,,"Кто этот человек?  Французский маршал, командующий войсками Антанты в конце Первой мировой войны.",images\img_4.png,Фердинанд Фош/Фош,"Анри Филипп Петэн, Робер Нивель"
,,"Кто этот человек?  Германский император, правивший до 1918 года.",images\img_5.png,Вильгельм II/Кайзер Вильгельм II,"Август фон Макензен, Рупрехт Баварский"
,,Кто этот человек? Последний премьер-министр Великобритании от Либеральной партии (1916–1922) ,images\img_6.png,Ллойд Джордж,"Дуглас Хейг, Джон Дентон Пикстон Френч"
,,Кто этот человек?  Глава Временного правительства России в 1917 году.,images\img_7.png,Керенский,"Сухомлинов, Львов"
,,"Кто этот человек? Германский генерал, один из авторов плана наступления 1918 года (операции «Наступление ради мира»).",images\img_8.png,Людендорф/Эрих Людендорф,"Конрад фон Гётцендорф, Александр фон Клюк"
,,"Кто этот человек? Немецкий революционер, объявивший о создании Веймарской республики в 1918 году.",images\img_9.png,Филипп Шейдеман/Шейдеман,"Карл Либкнехт, Эрнст Тельман"
,,"Кто этот человек? Германский фельдмаршал, позднее президент Веймарской республики.",images\img_10.png,Пауль фон Гинденбург/Гинденбург,"Эрих фон Фалькенгайн , Эрих Людендорф "
,4,Какое сражение (под каким городом) произошло в 1916 году?  ,images\img_11.png, Верденское сражение,"Штурм Льежа, Марнское сражение"
,,Какая битва/операция произошла в этом месте в 1915-1916 годах? ,images\img_12.png,Дарданелльская операция/Галлиполийская битва,"Дилиманское сражение, Августовская операция"
,,Какая страна обозначена на карте? ,images\img_13.png,Османская империя,"Иран, Саудовская Аравия"
,,Какой фронт обозначен на карте? ,images\img_14.png,Восточный/Восточный фронт,"Итальянский фронт, Западный фронт"
,,Какой пролив был ключевым в Дарданелльской операции?,images\img_15.png, Дарданеллы,"Босфор, Ла-Манш"
,,Какая страна обозначена на карте? ,images\img_16.png,Сербия,"Иран, Румыния"
,,Какой город обозначен на карте (обведен красным)? ,images\img_17.png,Париж,"Гавр, Орлеан"
,,Какой регион обозначен красным на карте? ,images\img_18.png,Эльзас-Лотарингия/Эльзас и Лотарингия,"Босния и Герцеговина, Палестина"
,,Какой фронт обозначен на карте? ,images\img_19.png,Итальянский/Итальянский фронт,"Восточный, Западный"
,,Какой город обозначен красным на карте?,images\img_20.png,Сараево,"Белград, София"
,5,Как назывался план быстрого разгрома Франции Германией? ,-,Шлиффена/план Шлиффена,
,,Какой газ впервые массово применили в Первой мировой? ,-,Хлор,
,,"Как назывался союз Германии, Австро-Венгрии и Италии?",-,Тройственный/Тройственный союз,
,,Какой новый вид вооружения впервые массово использовался в Первой мировой войне? ,-,Танки,
,,"Как назывался корабль, потопление которого послужило причиной вступления США в Первую мировую войну? ",-,Лузитания,
,,Как называлась крупнейшая морская битва Первой мировой войны?,-,Ютландская/Ютландское сражение,
,,Как называлась первая химическая атака в истории? ,-,Ипр/Чёрный день у Ипра,
,,Какой договор завершил войну на Восточном фронте в Первую мировую войну? ,-,Брестский мирный договор/Брестский/Брестский мир,
,,Как называлась последняя крупная операция Германии в 1918 году? ,-,Весеннее наступление/Михаэль,
,,Как называлась наступательная операция русского Юго-Западного фронта летом 1916 года в ходе Первой мировой войны?,-,Брусиловский прорыв,
Вторая мировая война,1,Вторая мировая война началась в 1941?,-,Нет,
,,"Ленд-лиз - программа, разработанная для поставки оружия из США в СССР?",-,Нет,
,,Основным союзником Германии была Великобритания?,-,Нет,
,,СССР участвовал во Второй мирововй войне с момента ее начала?,-,Нет,
,,Сталинградская битва стала переломной в ходе Великой отечественной войны?,-,Да,
,,Главным союзником Германии была Италия?,-,Да,
,,Суд над главными лицами военной Германии проходил в Берлине?,-,Нет,
,,Первая атомная бомба была сброшена на Берлин?,-,Нет,
,,Адольф Гитлер был приговорен к смертной казни?,-,Нет,
,,Италия вышла из войны раньше её официального окончания?,-,Да,
,2,Япония подписала акт о капитуляции раньше Германии?,-,Нет,
,,"Контрнаступительная операция СССР при Сталинграде называлась ""Уран""?",-,Да,
,,Осужденные в ходе Нюрнбергского процесса были казнены через расстрел?,-,Нет,
,,"Верно ли, что Франция капитулировала перед Германией быстрее, чем Польша в 1939 году?",-,Нет,
,,Первые решения касательно дальнейшего устройства мира после Второй мировой были приняты на Ялтинской конфернции?,-,Да,
,,Был ли танк «Тигр» был советским?,-,Нет,
,,Уинстон Черчилль возглавлял Великобританию с начала и до конца войны?,-,Нет,
,,"Правда ли, что битва за Москву началась до нападения Японии на Перл-Харбор",-,Да,
,,Первыми атомною бомбу создали в Германии?,-,Нет,
,,"Верно ли, что Япония пошла на переговоры сразу после капитуляции Германии?",-,Нет,
,3,"Кто изображен на фото? Маршал СССР, командовал обороной Москвы",images\img_21.png,Георгий Жуков,"Михаил Тухачевский, Климент Ворошилов"
,,"Чей это портрет? Британский премьер-министр, чья речь считается точкой начала Холодной войны",images\img_22.png,Уинстон Черчилль,"Невилл Чемберлен, Дуайт Эйзенхауэр"
,,"Кто это? Президент США, в годы правления которого произошла бомбардировка Японии",images\img_23.png,Гарри Трумэн,"Франклин Рузвельт, Олбен Баркли"
,,"Кто этот человек? Лидер фашистской Италии, союзник Гитлера",images\img_24.png,Бенито Муссолини,"Дино Гранди, Леонид Биссолати"
,,"Кто это? Президент США, инициатор программы ленд-лиза",images\img_25.png,Франклин Рузвельт,"Гарри Трумэн, Джон Гарнер"
,,"Кто изображен на портрете? Лидер «Свободной Франции», объединил французское сопротивление против нацистов",images\img_26.png,Шарль де Голль,"Мишель Дебре, Рене Коти"
,,"Кто это? Руководил обороной Москвы, Сталинградской и Курской битвами, взятием Берлина",images\img_27.png,Константин Рокоссовский,"Георгий Жуков, Михаил Тухачевский"
,,Кто на фото? Министр иностранных дел Германии,images\img_28.png,Иоахим фон Риббентроп,"Адольф Гитлер, Герман Геринг"
,,"Кто это? Командующий бомбардировочной авиацией Великобритании, архитектор стратегических бомбардировок Германии",images\img_29.png,Артур Харрис,"Бернард Монтгомери, Алан Тьюринг"
,,"Чей это портрет? Начальник Генштаба, планировал ключевые операции (Сталинград, Кёнигсберг), координировал действия фронтов",images\img_30.png,Александр Василевский,"Климент Ворошилов, Лаврентий Берия"
,4,"Выберите название военного плана, изображённого на карте",images\img_31.png,Барбаросса,"Вайс, Гельб"
,,Какой город обозначен на карте цифрой 1?,images\img_32.png,Сталинград,"Москва, Волгоград"
,,Какая операция изображена на карте?,images\img_33.png,Багратион,"Искра, Уран"
,,Что за город обозначен на карте цифрой 1?,images\img_34.png,Курск,"Воронеж, Волгоград"
,,Какая битва изображена на карте?,images\img_35.png,Московская/битва за Москву,"Сталинградская, Курская"
,,В каком году происходят обозначенные на схеме события?,images\img_36.png,1945,"1943, 1944"
,,Какая битва изображена на карте?,images\img_37.png,Сталинградская,"Москвоская, Смоленская"
,,Какой фронт находился под цифрой 3 на карте?,images\img_38.png,Западный,"Восточный, Центральный"
,,В каком году происходят обозначенные на схеме события?,images\img_39.png,1941,"1944, 1945"
,,В какому году началась изображенная на карте операция СССР?,images\img_40.png,1944,"1942, 1943"
,5,Как назывался план вторжения Германии в СССР?,-,Барбаросса,
,,На какой японский город первым были сброшены атомные бомбы США в 1945?,-,Хиросима,
,,Сколько стран состояло в Антигитлеровской коалиции?,-,26,
,,Кто со стороны СССР подписал договор о ненападении между СССР и Германией в 1939 году?,-,Молотов,
,,В каком году прошла Тегеранская конференция?,-,1943,
,,"За сколько недель план ""Барбаросса"" предполаагл захват СССР?",-,6,
,,В каком году Красная Армия освободила Киев?,-,1943,
,,"Как назывался японский город, уничтоженный второй атомной бомбой?",-,Нагасаки,
,,Какой месяц стал переломным в Сталинградской битве?,-,Ноябрь/ноябрь,
,,"На какой конференции обсуждались основные моменты послевоенного трибунала. Ответ напишите в формате ""..ая""",-,Лондонская/лондонская,